{
  "schemaVersion": 1,
  "extractionVersion": "2012.09.19.0001",
  "sourceEvidenceClass": "client_extraction",
  "sources": [
    {
      "path": "csv/status.csv",
      "bytes": 43499,
      "sha256": "3B09A76123B0FD8ABA320DC5513E8182820FEF409CF9D40F0B522B10B11D02EC",
      "rowCount": 399,
      "columnTypes": {
        "25": "s32",
        "31": "float",
        "42": "s32",
        "47": "float",
        "51": "bool",
        "52": "bool",
        "53": "float",
        "54": "bool",
        "55": "s8",
        "56": "bool",
        "57": "bool",
        "58": "bool"
      }
    },
    {
      "path": "csv/xtx_status.csv",
      "bytes": 331062,
      "sha256": "60ECA3B76D1D9799589D9059ADEB1E7C3D142E07609A1AD0A053C5E75D9B96EE",
      "rowCount": 399,
      "columnTypes": {
        "1": "str",
        "2": "str",
        "3": "str",
        "4": "str",
        "5": "str",
        "6": "s32",
        "7": "s32",
        "8": "str",
        "9": "s32",
        "10": "str",
        "11": "s32",
        "12": "s32",
        "13": "s32",
        "14": "s32",
        "15": "str",
        "16": "str",
        "17": "s32",
        "18": "s32",
        "19": "s32",
        "20": "str",
        "21": "str",
        "22": "str",
        "23": "str",
        "24": "str",
        "67": "str",
        "68": "str"
      }
    },
    {
      "path": "csv/gcRank.csv",
      "bytes": 736,
      "sha256": "56A1B837925824B3C42D1D54BBF450EAD7E1CB0704F6712DB79B9302CD880BA9",
      "rowCount": 22,
      "columnTypes": {
        "0": "u8",
        "1": "s32",
        "2": "s32",
        "6": "s32",
        "7": "s32",
        "8": "s32"
      }
    },
    {
      "path": "csv/xtx_gcRank.csv",
      "bytes": 8390,
      "sha256": "79DA51D4BD70E78F3AF2DBCFCCC018D6D9A85B93EF524EC187DA2ABB6663F297",
      "rowCount": 22,
      "columnTypes": {
        "3": "str",
        "4": "str",
        "5": "str",
        "9": "str",
        "10": "str",
        "11": "str",
        "12": "str",
        "13": "str",
        "14": "str",
        "15": "str",
        "16": "str",
        "17": "str",
        "18": "str",
        "19": "str",
        "20": "str",
        "21": "str",
        "22": "str",
        "23": "str",
        "24": "str",
        "25": "str",
        "26": "str",
        "27": "str",
        "28": "str",
        "29": "str"
      }
    },
    {
      "path": "csv/materia.csv",
      "bytes": 24842,
      "sha256": "1DD9AF2B7A8C2C2F63221AAEEFF412C8050E0941A6C530317C3C644F36D91675",
      "rowCount": 66,
      "columnTypes": {
        "0": "s32",
        "1": "s32",
        "2": "s32",
        "3": "s32",
        "4": "s32",
        "5": "s16",
        "6": "s16",
        "7": "s16",
        "8": "s16",
        "9": "s16",
        "10": "s16",
        "11": "s16",
        "12": "s16",
        "13": "s16",
        "14": "s16",
        "15": "s16",
        "16": "s16",
        "17": "s16",
        "18": "s16",
        "19": "s16",
        "20": "s16",
        "21": "s32",
        "22": "s16",
        "23": "s16",
        "24": "s16",
        "25": "s16",
        "26": "s16",
        "27": "s16",
        "28": "s16",
        "29": "s16",
        "30": "s16",
        "31": "s16",
        "32": "s16",
        "33": "s16",
        "34": "s16",
        "35": "s16",
        "36": "s16",
        "37": "s16",
        "38": "s32",
        "39": "s32",
        "40": "s32",
        "41": "s32",
        "42": "bool",
        "43": "bool",
        "44": "bool",
        "45": "bool",
        "46": "bool",
        "47": "bool",
        "48": "bool",
        "49": "bool",
        "50": "bool",
        "51": "bool",
        "52": "bool",
        "53": "bool",
        "54": "bool",
        "55": "bool",
        "56": "bool",
        "57": "bool",
        "58": "bool",
        "59": "bool",
        "60": "bool",
        "61": "bool",
        "62": "bool",
        "63": "bool",
        "64": "bool",
        "65": "bool",
        "66": "bool",
        "67": "bool",
        "68": "bool",
        "69": "bool",
        "70": "bool",
        "71": "bool",
        "72": "bool",
        "73": "bool",
        "74": "bool",
        "75": "bool",
        "76": "bool",
        "77": "bool",
        "78": "bool",
        "79": "bool"
      }
    },
    {
      "path": "csv/materiaBook.csv",
      "bytes": 36924,
      "sha256": "F341265CC9E109E5C2B43F0ACC8BD672510CCA448D267B92CDAFE956D7FC8E1E",
      "rowCount": 52,
      "columnTypes": {
        "0": "str",
        "1": "str",
        "2": "str",
        "3": "str",
        "4": "str"
      }
    }
  ],
  "products": {
    "status_names": {
      "path": "derived/status_names.csv",
      "bytes": 50182,
      "sha256": "BC15E20841A7D0AC13ADB0760166795C13924B72FB821025B79D0E218EA86208",
      "rowCount": 399,
      "source": "csv/status.csv",
      "fields": [
        "status_id",
        "name_en",
        "name_ja",
        "placeholder",
        "icon_text",
        "status_col_25",
        "status_col_31",
        "status_col_42",
        "status_col_47",
        "status_col_51",
        "status_col_52",
        "status_col_53",
        "status_col_54",
        "status_col_55",
        "status_col_56",
        "status_col_57",
        "status_col_58",
        "source_row"
      ],
      "textColumns": {
        "name_en": 3,
        "name_ja": 1,
        "icon_text": 24
      },
      "typedColumns": {
        "status_col_25": 25,
        "status_col_31": 31,
        "status_col_42": 42,
        "status_col_47": 47,
        "status_col_51": 51,
        "status_col_52": 52,
        "status_col_53": 53,
        "status_col_54": 54,
        "status_col_55": 55,
        "status_col_56": 56,
        "status_col_57": 57,
        "status_col_58": 58
      },
      "textSource": "csv/xtx_status.csv",
      "placeholderCount": 95
    },
    "gc_rank": {
      "path": "derived/gc_rank.csv",
      "bytes": 5140,
      "sha256": "B00C28217902142C60EFAF1DE16479F32F7CB9A39DD1913BF66492E7E42DEFCD",
      "rowCount": 66,
      "source": "csv/gcRank.csv",
      "fields": [
        "rank_id",
        "company",
        "name_variant",
        "name_en",
        "name_ja",
        "linear_rank",
        "seal_maximum",
        "seals_needed_next_rank",
        "icon_company_1",
        "icon_company_2",
        "icon_company_3",
        "source_row"
      ],
      "textColumns": {
        "name_en": [
          9,
          10,
          11
        ],
        "name_ja": [
          3,
          4,
          5
        ]
      },
      "typedColumns": {
        "linear_rank": 0,
        "seal_maximum": 1,
        "seals_needed_next_rank": 2,
        "icon_company_1": 6,
        "icon_company_2": 7,
        "icon_company_3": 8
      },
      "mappingEvidence": "xivl-client-scripts:docs/gc-promotion-client-contract.md#player-state-and-sheet-consumers",
      "textSource": "csv/xtx_gcRank.csv"
    },
    "materia": {
      "path": "derived/materia.csv",
      "bytes": 25834,
      "sha256": "C0FD0777FD92922579F3D90AAF620E48CEFFED5B572A08206F8BD9EC28B7D114",
      "rowCount": 66,
      "source": "csv/materia.csv",
      "fields": [
        "materia_id",
        "catalog_id_quality_group_0",
        "catalog_id_quality_group_1",
        "catalog_id_quality_group_2",
        "catalog_id_quality_group_3",
        "parameter_1",
        "value_1_quality_0",
        "value_1_quality_1",
        "value_1_quality_2",
        "value_1_quality_3",
        "value_1_quality_4",
        "value_1_quality_5",
        "value_1_quality_6",
        "value_1_quality_7",
        "value_1_quality_8",
        "value_1_quality_9",
        "value_1_quality_10",
        "value_1_quality_11",
        "value_1_quality_12",
        "value_1_quality_13",
        "value_1_quality_14",
        "value_1_quality_15",
        "parameter_2",
        "value_2_quality_0",
        "value_2_quality_1",
        "value_2_quality_2",
        "value_2_quality_3",
        "value_2_quality_4",
        "value_2_quality_5",
        "value_2_quality_6",
        "value_2_quality_7",
        "value_2_quality_8",
        "value_2_quality_9",
        "value_2_quality_10",
        "value_2_quality_11",
        "value_2_quality_12",
        "value_2_quality_13",
        "value_2_quality_14",
        "value_2_quality_15",
        "icon_quality_group_0",
        "icon_quality_group_1",
        "icon_quality_group_2",
        "icon_quality_group_3",
        "materia_col_42",
        "materia_col_43",
        "materia_col_44",
        "materia_col_45",
        "materia_col_46",
        "materia_col_47",
        "materia_col_48",
        "materia_col_49",
        "materia_col_50",
        "materia_col_51",
        "materia_col_52",
        "materia_col_53",
        "materia_col_54",
        "materia_col_55",
        "materia_col_56",
        "materia_col_57",
        "materia_col_58",
        "materia_col_59",
        "materia_col_60",
        "materia_col_61",
        "materia_col_62",
        "materia_col_63",
        "materia_col_64",
        "materia_col_65",
        "materia_col_66",
        "materia_col_67",
        "materia_col_68",
        "materia_col_69",
        "materia_col_70",
        "materia_col_71",
        "materia_col_72",
        "materia_col_73",
        "materia_col_74",
        "materia_col_75",
        "materia_col_76",
        "materia_col_77",
        "materia_col_78",
        "materia_col_79",
        "source_row"
      ],
      "textColumns": {},
      "typedColumns": {
        "catalog_id_quality_group_0": 0,
        "catalog_id_quality_group_1": 1,
        "catalog_id_quality_group_2": 2,
        "catalog_id_quality_group_3": 3,
        "parameter_1": 4,
        "value_1_quality_0": 5,
        "value_1_quality_1": 6,
        "value_1_quality_2": 7,
        "value_1_quality_3": 8,
        "value_1_quality_4": 9,
        "value_1_quality_5": 10,
        "value_1_quality_6": 11,
        "value_1_quality_7": 12,
        "value_1_quality_8": 13,